ZRJwVLyzEJq1VAihDhYiow	0	2011-07-27	0	IjZ33sJrzXqU-0X6U8NwyA	4	"I have no idea why some people give bad reviews about this place. It goes to show you, you can please everyone. They are probably griping about something that their own fault...there are many people like that.In any case, my friend and I arrived at about 5:50 PM this past Sunday. It was pretty crowded, more than I thought for a Sunday evening and thought we would have to wait forever to get a seat but they said we'll be seated when the girl comes back from seating someone else. We were seated at 5:52 and the waiter came and got our drink orders. Everyone was very pleasant from the host that seated us to the waiter to the server. The prices were very good as well. We placed our orders once we decided what we wanted at 6:02. We shared the baked spaghetti calzone and the small ""Here's The Beef"" pizza so we can both try them. The calzone was huge and we got the smallest one (personal) and got the small 11"" pizza. Both were awesome! My friend liked the pizza better and I liked the calzone better. The calzone does have a sweetish sauce but that's how I like my sauce!We had to box part of the pizza to take it home and we were out the door by 6:42. So, everything was great and not like these bad reviewers. That goes to show you that  you have to try these things yourself because all these bad reviewers have some serious issues."	business	0	0a2KyEL0d3Yb1V6aivbIuQ	Spinato's Pizzeria	Phoenix	4848 E Chandler Blvd Phoenix, AZ 85044	33.305606842	-111.978759766	[]	True	102	AZ
6oRAC4uyJCsJl1X0WZpVSA	0	2012-06-14	0	IESLBzqUCLdSzSqm0eCSxQ	5	love the gyro plate. Rice is so good and I also dig their candy selection :)	business	1	0hT2KtfLiobPvh6cDC8JQg	Haji-Baba	Tempe	1513 E  Apache Blvd Tempe, AZ 85281	33.4143447876	-111.913032532	[]	True	265	AZ
_1QQZuf4zZOyFCvXc0o6Vg	1	2010-05-27	0	G-WvGaISbqqaMHlNnByodA	5	Rosie, Dakota, and I LOVE Chaparral Dog Park!!! It's very convenient and surrounded by a lot of paths, a desert xeriscape, baseball fields, ballparks, and a lake with ducks.The Scottsdale Park and Rec Dept. does a wonderful job of keeping the park clean and shaded.  You can find trash cans and poopy-pick up mitts located all over the park and paths.The fenced in area is huge to let the dogs run, play, and sniff!	business	2	uZetl9T0NcROGOyFfughhg	Chaparral Dog Park	Scottsdale	5401 N Hayden Rd Scottsdale, AZ 85250	33.5229454041	-111.90788269	[]	True	88	AZ
6ozycU1RpktNG2-1BroVtw	0	2012-01-05	0	1uJFq2r5QfJG_6ExMRCaGw	5	"General Manager Scott Petello is a good egg!!! Not to go into detail, but let me assure you if you have any issues (albeit rare) speak with Scott and treat the guy with some respect as you state your case and I'd be surprised if you don't walk out totally satisfied as I just did. Like I always say..... ""Mistakes are inevitable, it's how we recover from them that is important""!!!Thanks to Scott and his awesome staff. You've got a customer for life!! .......... :^)"	business	0	vYmM4KTsC8ZfQBg-j5MWkw	Discount Tire	Mesa	1357 S Power Road Mesa, AZ 85206	33.3910255432	-111.68447876	[]	True	5	AZ
-yxfBYGB6SEqszmxJxd97A	4	2007-12-13	1	m2CKSsepBCoRYWxiRUsxAg	4	Quiessence is, simply put, beautiful.  Full windows and earthy wooden walls give a feeling of warmth inside this restaurant perched in the middle of a farm.  The restaurant seemed fairly full even on a Tuesday evening; we had secured reservations just a couple days before.My friend and I had sampled sandwiches at the Farm Kitchen earlier that week, and were impressed enough to want to eat at the restaurant.  The crisp, fresh veggies didn't disappoint: we ordered the salad with orange and grapefruit slices and the crudites to start.  Both were very good; I didn't even know how much I liked raw radishes and turnips until I tried them with their pesto and aioli sauces.For entrees, I ordered the lamb and my friend ordered the pork shoulder.  Service started out very good, but trailed off quickly.  Waiting for our food took a very long time (a couple seated after us received and finished their entrees before we received our's), and no one bothered to explain the situation until the maitre'd apologized almost 45 minutes later.  Apparently the chef was unhappy with the sauce on my entree, so he started anew.  This isn't really a problem, but they should have communicated this to us earlier.  For our troubles, they comped me the glass of wine I ordered, but they forgot to bring out with my entree  as I had requested.  Also, they didn't offer us bread, but I will echo the lady who whispered this to us on her way out: ask for the bread.  We received warm foccacia, apple walnut, and pomegranate slices of wonder with honey and butter.  YUM.The entrees were both solid, but didn't quite live up to the innovation and freshness of the vegetables.  My lamb's sauce was delicious, but the meat was tough.  Maybe the vegetarian entrees are the way to go?  But our dessert, the gingerbread pear cake, was yet another winner.If the entrees were tad more inspired, or the service weren't so spotty, this place definitely would have warranted five stars.  If I return, I'd like to try the 75$ tasting menu.  Our bill came out to about 100$ for two people, including tip, no drinks.	business	3	sqYN3lNgvPbPCTRsMFu27g	Quiessence Restaurant	Phoenix	6106 S 32nd St Phoenix, AZ 85042	33.3907928467	-112.012504578	[]	True	109	AZ
zp713qNhx8d9KCJJnrw1xA	7	2010-02-12	4	riFQ3vxNpP4rWLk_CSri2A	4	"Drop what you're doing and drive here. After I ate here I had to go back the next day for more.  The food is that good.This cute little green building may have gone competely unoticed if I hadn't been driving down Palm Rd to avoid construction.  While waiting to turn onto 16th Street the ""Grand Opening"" sign caught my eye and my little yelping soul leaped for joy!  A new place to try!It looked desolate from the outside but when I opened the door I was put at easy by the decor, smell and cleanliness inside.  I ordered dinner for two, to go.  The menu was awesome.  I loved seeing all the variety: poblano peppers, mole, mahi mahi, mushrooms...something wrapped in banana leaves.  It made it difficult to choose something.  Here's what I've had so far: La Condesa Shrimp Burro and Baja Sur Dogfish Shark Taco.  They are both were very delicious meals but the shrimp burro stole the show.  So much flavor.  I snagged some bites from my hubbys mole and mahi mahi burros- mmmm such a delight.  The salsa bar is endless.  I really stocked up.  I was excited to try the strawberry salsa but it was too hot, in fact it all was, but I'm a big wimp when it comes to hot peppers. The horchata is handmade and delicious.  They throw pecans and some fruit in there too which is a yummy bonus!As if the good food wasn't enough to win me over the art in this restaurant sho did!  I'm a sucker for Mexican folk art and Frida Kahlo is my Oprah.  There's a painting of her and Diego hanging over the salsa bar, it's amazing.  All the paintings are great, love the artist."	business	7	wFweIWhv2fREZV_dYkz_1g	La Condesa Gourmet Taco Shop	Phoenix	1919 N 16th St Phoenix, AZ 85006	33.4691314697	-112.04750824	[]	True	307	AZ
hW0Ne_HTHEAgGF1rAdmR-g	0	2012-07-12	0	JL7GXJ9u4YMx7Rzs05NfiQ	3	Luckily, I didn't have to travel far to make my connecting flight. And for this, I thank you, Phoenix.My brief layover was pleasant as the employees were kind and the flight was on time.  Hopefully, next time I can grace Phoenix with my presence for a little while longer.	business	1	1ieuYcKS7zeAv_U15AB13A	Phoenix Sky Harbor International Airport	Phoenix	3400 E Sky Harbor Blvd Phoenix, AZ 85034	33.4347496033	-112.006439209	[]	True	862	AZ
wNUea3IXZWD63bbOQaOH-g	0	2012-08-17	0	XtnfnYmnJYi71yIuGsXIUA	3	Definitely come for Happy hour! Prices are amazing, sake bombers for $3...Great atmosphere and wait staff was incredibly nice and right on to all of our needs, didn't have to ask for a thing They were always spot on...Place gets crowded in the evening especially if you plan on sitting outside. I only wish there were one in Apollo Beach or Brandon!	business	0	Vh_DlizgGhSqQh4qfZ2h6A	Stingray Sushi	Phoenix	2574 E Camelback Rd Phoenix, AZ 85016	33.5096054077	-112.025741577	[]	True	163	AZ
nMHhuYan8e3cONo3PornJA	0	2010-08-11	0	jJAIXA46pU1swYyRCdfXtQ	5	Nobuo shows his unique talents with everything on the menu. Carefully crafted features with much to drink. Start with the pork belly buns and a stout. Then go on until you can no longer.	business	1	sUNkXg8-KFtCMQDV6zRzQg	Nobuo At Teeter House	Phoenix	622 E Adams St Phoenix, AZ 85004	33.4495391846	-112.065666199	[]	True	189	AZ
AsSCv0q_BWqIe3mX2JqsOQ	1	2010-06-16	1	E11jzpKz9Kw5K7fuARWfRw	4	The oldish man who owns the store is as sweet as can be.  Perhaps sweeter than the cookies or ice cream.Here's the lowdown: Giant ice cream cookie sandwiches for super cheap.  The flavor permutations are basically endless.  I had snickerdoodle with cookies and cream ice cream.  It was marvelous.	business	3	-OMlS6yWkYjVldNhC31wYg	Cookiez On Mill	Tempe	514 S Mill Ave Ste 102 Tempe, AZ 85281	33.4248809814	-111.940200806	[]	False	74	AZ
e9nN4XxjdHj4qtKCOPq_vg	1	2011-10-21	0	3rPt0LxF7rgmEUrznoH22w	4	Wonderful Vietnamese sandwich shoppe. Their baguettes are great hot out of the oven with butter or in one of their many sandwich choices. They have a modest selection of baked goods along with some of the best egg rolls around. Bring cash or your ATM card as no credit cards are accepted but they have an ATM on premises.	business	1	C1rHp3dmepNea7XiouwB6Q	Lee's Sandwiches	Chandler	1901 W Warner Rd Chandler, AZ 85224	33.3347129822	-111.874786377	[]	True	192	AZ
h53YuCiIDfEFSJCQpk8v1g	1	2010-01-11	0	cGnKNX3I9rthE0-TH24-qA	4	They have a limited time thing going on right now with BBQ chicken pizza (not sure how long it's going to last) but let me just say it was amazing.  Probably THE best BBQ Chicken pizza I have ever had.  I have tried other things too, like the tomato basil soup, and many of their sandwiches ... very good, very fresh - every time.  The 5 stars is for the pizza, but if I were to rate Jason's Deli over all they would get about a 4.	business	2	UPtysDF6cUDUxq2KY-6Dcg	Jason's Deli	Gilbert	1065 E Baseline Rd Gilbert, AZ 85233	33.3796195984	-111.809425354	[]	True	36	AZ
WGNIYMeXPyoWav1APUq7jA	1	2011-12-23	0	FvEEw1_OsrYdvwLV5Hrliw	5	Good tattoo shop. Clean space, multiple artists to choose from and books of their work are available for you to look though and decide who's style most mirrors what you're looking for. I chose Jet to do a cover-up for me and he worked with me on the design and our ideas and communication flowed very well. He's a very personable guy, is friendly and keeps the conversation going while he's working on you, and he doesn't dick around (read: He starts to work and continues until the job is done). He's very professional and informative. Good customer service combines with talent at the craft.	business	2	Xm8HXE1JHqscXe5BKf0GFQ	The Lady Luck Tattoo Gallery	Tempe	961 E Guadalupe Rd Tempe, AZ 85283	33.3637619019	-111.9272995	[]	True	25	AZ
yc5AH9H71xJidA_J2mChLA	1	2010-05-20	0	pfUwBKYYmUXeiwrhDluQcw	4	I'm 2 weeks new to Phoenix. I looked up Irish bars in town and found Rosie's. The decor and ambience was outstanding. I went there by myself on a Wednesday night in hopes of finding some friendly folks and that is exactly what happened. I ate dinner at the bar. Marcy was the bartender and she was very friendly and helpful and she introduced me to a whole bunch of people. For dinner I had a Rueben sandwich, which was pretty large and very good. I had a a small Rosie salad as my side and it did the job. I wish it was made with lettuce other than iceburg, but the bacon & eggs & other toppings helped a whole lot. I drank a nice, cold Smithwick's from the tap. Followed that up with 2 vodka tonics and my whole tab was under $25! The basketball game was on when I first got there. After the game, the jukebox was playing a fabulous mix of the best oldies. Around 10pm a live band played. I didn't catch much of their performance but I did notice that I really like the singer's voice and that's rare for me since I don't typically care for female vocalists.All the people I spoke to were super nice and very welcoming. I am sure I will see a bunch (or all) of them again and I look forward to that!	business	1	JOG-4G4e8ae3lx_szHtR8g	Rosie McCaffrey's	Phoenix	906 E Camelback Rd Phoenix, AZ 85014	33.5095176697	-112.061569214	[]	True	151	AZ
4JzzbSbK9wmlOBJZWYfuCg	1	2011-11-17	1	a0lCu-j2Sk_kHQsZi_eNgw	3	They've gotten better and better for me in the time since this review was written. My last contact with them was a few days ago when I was having trouble redeeming some Groupons on their website. I called customer service and after waiting a few minutes I spoke with a rep who cheerfully booked four separate flights for me, patiently and manually entering my Groupon info for each one.I think the acquisition by Republic has helped them overall. After Republic took over the in-flight cookies started. It still tends to suck if you aren't Ascent club (like just about any budget-centric airline does), but once you get there it's a good value. When I've had to fly Southwest or USAir I've been disappointed in comparison.	business	1	nDBly08j5URmrHQ2JCbyiw	Frontier Airlines	Phoenix	Phoenix Sky Harbor Airport Terminal 3 Phoenix, AZ 85034	33.4396476746	-112.026153564	[]	True	13	AZ
8FNO4D3eozpIjj0k3q5Zbg	2	2008-10-08	1	MuqugTuR5DdIPcZ2IVP3aQ	3	DVAP....You have to go at least once in your life. It really is a neat place with alot of history. The service is great, it appears to be family run. The food is good. Better then Dennys but not as good as Mimi's. I had the all u can eat of beef ribs, lasagna, meat loaf, cat fish, chicken, mashed and diced potatoes, stuffing, rice, homemade apple pie, etc and salad bar. I know I am missing a bunch of stuff they had but you get the drift. They run specials on Prime rib and stuff so you might want to call to see what they are serving the night you go.	business	4	C6IOtaaYdLIT5fWd7ZYIuA	Deer Valley Airport Restaurant	Phoenix	702 W Deer Valley Rd Phoenix, AZ 85027	33.684173584	-112.085952759	[]	True	27	AZ
tdcjXyFLMKAsvRhURNOkCg	1	2011-06-28	2	LmuKVFh03Uz318VKnUWrxA	5	This place shouldn't even be reviewed - because it is the kind of place I want to keep for myself...  =)	business	1	YN3ZLOdg8kpnfbVcIhuEZA	Old Town Tavern	Scottsdale	7320 E Scottsdale Mall Scottsdale, AZ 85251	33.4932327271	-111.924095154	[]	True	81	AZ
eFA9dqXT5EA_TrMgbo03QQ	0	2011-07-13	0	CQYc8hgKxV4enApDkx0IhA	4	first time my friend and I went there... it was delicious!  The food, garlic knots our favorite and of course the wine!  We will be going back ALOT!	business	0	6lg55RIP23VhjYEBXJ8Njw	Crust Pizzeria & Ristorante	Phoenix	4727 E Bell Rd Phoenix, AZ 85032	33.6410598755	-111.977935791	[]	True	30	AZ
IJ0o6b8bJFAbG6MjGfBebQ	0	2010-09-05	1	Dx9sfFU6Zn0GYOckijom-g	2	U can go there n check the car out. If u wanna buy 1 there? That's wrong move! If u even want a car service from there? U made a biggest mistake of ur life!! I had 1 time asked my girlfriend to take my car there for an oil service, guess what? They ripped my girlfriend off by lying how bad my car is now. If without fixing the problem. Might bring some serious accident. Then she did what they said. 4 brand new tires, timing belt, 4 new brake pads. U know why's the worst? All of those above I had just changed 2 months before!!! What a trashy dealer is that? People, better off go somewhere!	business	1	zRlQEDYd_HKp0VS3hnAffA	Riverview Nissan	Mesa	2025 W Riverview Auto Dr Mesa, AZ 85201	33.4339942932	-111.872543335	[]	False	7	AZ
JhupPnWfNlMJivnWB5druA	0	2011-05-22	0	cFtQnKzn2VDpBedy_TxlvA	4	I love this place! I have been coming here for ages.My favorites: Elsa's Chicken sandwich, any of their burgers, dragon chicken wings, china's little chicken sandwich, and the hot pepper chicken sandwich. The atmosphere is always fun and the art they display is very abstract but totally cool!	business	1	13xj6FSvYO0rZVRv5XZp4w	AZ 88	Scottsdale	7353 E Scottsdale Mall Scottsdale, AZ 85251	33.4923362732	-111.923652649	[]	True	299	AZ
wzP2yNpV5p04nh0injjymA	0	2010-05-26	0	ChBeixVZerfFkeO0McdlbA	4	This place is great.  A nice little ole' fashion homemade ice cream place that looks like it has been there for forever.  The place has a real nice vibe to it.  Sorta reminds me of Sugar Bowl only smaller, not as busy, and easier parking.The menu is ginormous.  I couldn't decide what to get but that didn't matter because the other 3 people I went with chose for me.  I wanted something basic but they insisted on sharing the 'patte' thing.  It is a few scoops of ice cream over a brownie and topped with whip cream and caramel.  While it was very good it just wasn't what I wanted.  Next time I'm just going to get a scoop or 2 of the ice cream so I can really taste what the ice cream is all about.  It is just too difficult to tell when it is topped with a bunch of stuff.  The ice cream we got on the brownie though (butter brittle I think) was excellent.  They have tons of different flavors and they all sound delish!Anyway I can't wait to go back if I am ever in the area again and need a sugar rush!	business	0	rLtl8ZkDX5vH5nAx9C3q5Q	Mary Coyle's Ol' Fashioned Ice Cream and Yogurt Parlor	Phoenix	5521 N 7th Ave Phoenix, AZ 85013	33.5174293518	-112.082305908	[]	True	100	AZ
qjmCVYkwP-HDa35jwYucbQ	0	2013-01-03	0	kZ4TzrVX6qeF0OvrVTGVEw	4	I love love LOVE this place. My boss (who is into healthy eating) recommended this place. I went over with some highly skeptical friends and one dinner was enough to convert them into believers! The food here is so good! We had the Shrimp dumplings and the Onion tart as starters. We ordered the Shirataki noodles and street tacos as entrees. So also ordered the Kale-aid. All of the dishes were yummy. I have gone back many times since then and have never been disappointed! I have gone after yoga to get some Kale salad or the chicken chopped salad. I always have to get the Kale aid. Once, a guy at the next table, uprooted a whole plant by mistake (on the patio) and was highly embarrassed as was his date! Ever since, I have very careful not to throw my arms around as I can be quite clumsy sometimes! I do NOT want to be banned from my favorite place for my clumsiness! I don't think I can live without True Food!	business	0	fpItLlgimq0nRltWOkuJJw	True Food Kitchen	Phoenix	2502 E Camelback Rd Phoenix, AZ 85016	33.5102081299	-112.027206421	[]	True	434	AZ
wct7rZKyZqZftzmAU-vhWQ	2	2008-03-21	1	B5h25WK28rJjx4KHm4gr7g	4	Not that my review will mean much given the more in-depth reviewers but I will chime in nonetheless...I can really only review one dish, the #3 lunch special, Yellow Curry Chicken. I don't know what the authentic name for it is, Kang Karee something or other. It's so tasty that the first time I had it I knew I'd never branch out. Good lunch spot if you work around downtown. Not the quickest service all the time and can get busy during lunch, but always consistently good. Fairly dim inside, a good place to forget about the sun on a summer day.	business	4	RRTraCQw77EU4yZh0BBTag	Thai Lahna Restaurant	Phoenix	3738 E Indian School Rd Phoenix, AZ 85018	33.4951553345	-112.001022339	[]	True	101	AZ
vz2zQQSjy-NnnKLZzjjoxA	1	2011-03-30	1	Y_ERKao0J5WsRiCtlKSNSA	3	Came here for breakfast yesterday, it had been years since I have stopped in here and do not remember the entire place having waiter service.  Place was empty at 9am on a Tuesday morning but the atmosphere was casual, this place is pretty much been here for as long as I can remember and I am one of the 2 people that are native to Phoenix.  I always felt it was pricey but I think inflation has caught up since prices seemed normal when I went yesterday.  I loved the chips and salsa, the hot sauce is fantastic with a great spicy kick.  I went with the recommendation of the chile relleno which isn't my favorite but I like going with what waiters say so I gave it a try.  It was great!  Very flavorful and they just put it on the eggs so you can eat it together, the tortillas are fresh and home-made tasting, the hash browns and beans were good too.  I read my newspaper and drank my soda while I enjoyed the whole place to myself....oh yeah, I read some Yelp reviews and bookmarked my next stop too, ha ha.	business	1	EP3cGJvYiuOwumerwADplg	Sylvia's La Canasta Mexican Restaurant	Phoenix	5502 N 7th Ave Phoenix, AZ 85013	33.5168495178	-112.082458496	[]	True	80	AZ
vvA3fbps4F9nGlAEYKk_sA	0	2012-05-04	0	S9OVpXat8k5YwWCn6FAgXg	4	Disgusting!  Had a Groupon so my daughter and I tried it out.  Very outdated and gaudy 80's style interior made me feel like I was in an episode of Sopranos.  The food itself was pretty bad.  We ordered pretty simple dishes but they just had no flavor at all!  After trying it out I'm positive all the good reviews on here are employees or owners creating them.	business	1	8AMn6644NmBf96xGO3w6OA	Avanti Restaurant of Distinction	Phoenix	2728 E Thomas Rd Phoenix, AZ 85016	33.4804916382	-112.022193909	[]	True	50	AZ
rxQ2PIjhAx6dgAqUalf99Q	0	2012-09-09	0	-v-shjbxoj7hpU62yn6vag	5	Never having dealt with a Discount Tire in Phoenix before (only in Texas, and their service has been great all the time), I came in not knowing what kind of service to expect. I was pleasantly surprised! The store had a good amount of parking, and the store front was clean, open and had adequate seating around the perimeters. There were already 5-6 people sitting and waiting for their cars to be finished, and 2 people waiting infront of me to see a representative. All the guys working there were busy helping someone, yet were saying hello to us and reassuring they'd get to us very soon. I didn't wait an unneccesary amount of time and then was helped by Wally. He inspected my tires, recommended a plan of action gave me options, and we headed back into the store. After I made my decision to replace 2 of the tires, he checked their stock, and unfortunately they didn't have them there. BUT he called another store and had them picked up for the next morning, so I could just come back the next day to this same store and get those bad boys installed. Great! The prices were not as heafty (relief), and although there were a good amount of people the next day waiting for their cars to also be serviced, it took exactly the amount of time they'd told me (45 min). They apologized for the wait, but no need for that! The guy who helped me on the 2nd day (I'm sorry I forgot his name) was also very professional and great. I recommend this store and will be bringing my car here in the future most definitely. Thanks, guys!TIP: If you know you need to bring your car in, you can make an appointment with them online. They take walk-ins, but I believe it helps them manage their customers easier, and that in turn benefits you.	business	0	HLbhD2OyiMCUDRR4c1iXaw	Discount Tire	Glendale	7920 W Bell Road Glendale, AZ 85308	33.638671875	-112.229530334	[]	True	11	AZ
qjmCVYkwP-HDa35jwYucbQ	0	2010-03-28	0	2VTwjhOX3UUvgOGbxe4xfA	4	I went here again when I got back to Phoenix after being gone for six months. This is one of my mom's favorite places to eat and I can understand why. The ravioli and the miso soup are so delicious! The wine was ok and I would recommend one of their elixirs over an alcohol beverage. Still a pretty delicious place to go in Phoenix.	business	0	3iuZFgxUFKLxOplkDrFmyg	True Food Kitchen	Phoenix	2502 E Camelback Rd Phoenix, AZ 85016	33.5102081299	-112.027206421	[]	True	434	AZ
3oLy0rlzRI_xiqfQHqC4_g	1	2011-03-27	1	Bk7F8IyBuOHVp6w3BAKVow	4	There's two ways to look at this place. One is getting quality food at a good price. The other is getting a lot of food for a cheap price. I prefer the former but those who prefer the latter won't agree with my review.I thought the scramble I had was okay but nothing fantastic. I definitely didn't care for the biscuits. The food wasn't health conscious at all but if you're looking to fill up with calories and get a good-sized portion then this is your type of place. Also, I am not a fan of the diner-type ambiance... I would rather have something with more character but I'm glad I tried this place out.	business	3	1guJDgUfTiDdbgKqBhsZFQ	Biscuits	Phoenix	4623 E Elliott Rd Phoenix, AZ 85044	33.3487052917	-111.983253479	[]	True	60	AZ
o1GIYYZJjM6nM03fQs_uEQ	0	2011-11-30	3	ApKbwpYJdnhhgP4NbjQw2Q	4	I've eaten here many times, but none as bad as last night.Service was excellent, and highly attentive.Food, absolutely horrible.My expectation was they would serve a steak on par with their seafood. After all, they were charging 39 bucks for a ribeye. What I was hoping for was a 1- 1-1/2' thick steak, cooked Pittsburgh style as I had ordered. What I got a a 3/4 in thick piece of meat that was mostly fat, gristle, and in no way resembled Pittsburgh Style. Salad, similar to something you could get at Chick FiletVeggies, blah.Bread basket, ample, but day old, and if not, it certainly wasn't fresh. In addition to bad food, we were crammed into a small room where we were nuts to butts with 6 other tables, listening to conversations ranging from someone's recent bout with pinkeye, and another couple who elected to speak entirely in French, until the waiter showed up, then it was like they turned off the French switch and suddenly began speaking English. I've had it with this place.If I'm going to pay 150 bucks for dinner, it'll be at Mortons, or Maestro where the steaks are 1-1/2 in thick, cooked to perfection, and half of it doesnt wind up on the plate as fat and gristle	business	4	iwUN95LIaEr75TZE_JC6bg	Salt Cellar	Scottsdale	550 N Hayden Rd Scottsdale, AZ 85257	33.4542694092	-111.909416199	[]	True	147	AZ
