AGar9KVq_W7YcF76avbDTw	0	2012-10-16	0	gNm48xplqt42p-NvCkzUBg	4	Very clean and well thought out floor plans, nice to have a friendly staff with smiling faces. Best Target I have been to in a while.	business	0	370JyOQfFcPSB9_jk641gA	Target	Phoenix	21001 N Tatum Blvd Ste 1630 Phoenix, AZ 85050	33.6786155701	-111.974609375	[]	True	15	AZ
-kVXDEqGHOWKxQ3EhvFgVA	0	2011-01-02	0	5V9lfjjlY7tkXgkcDUWYyg	4	This Mexican food is very simple, slightly bland, but fairly fresh. The chicken is chopped up into tofu-looking squares. But I was satisfied with the food, which was fairly healthy Mexican food as Mexican food goes. The staff is quite polite. I met some cool people hanging out there while I sat outside.	business	0	Ja8SAyDdf1aY-E7vVixJiw	Kokopelli Mexican Grill	Scottsdale	14747 N Northsight Blvd Ste 116 Scottsdale, AZ 85260	33.6187896729	-111.897407532	[]	False	12	AZ
qyNtVViurIcChc35mfYIEw	1	2008-07-09	0	1fRGR6XTTElRBZW_oDrpUA	4	Decor  functional Staff friendly and are really kind to our toddlerfood rocks  within my  limited range of  red and yellow curries ( so much so they suggested I try something else, hey it's not my fault these are so good that I didn't want to risk anything lesser. Prices are a bargain for entrees,  spice is there, they really get the request to make it very very hot.   This is probably the best bargain  in North Phoenix for  spice hounds	business	1	N3L6SDymSRkYQtTiSDmXSg	Touch Of Thai	Phoenix	16816 N 35th Ave Phoenix, AZ 85053	33.6382865906	-112.13482666	[]	True	85	AZ
umdxfhSlk67yGEi8-S-bEg	0	2011-11-09	0	2sG6LKzRz91l10stVHl8uQ	3	This Place just opened up next to the salon I work in. AMAZING! They hit the ground running, It's a deli style, where you order at the counter and they bring you the food. I had the Grayhawk Turkey Club and the turkey was great! No packaged crap here. It was thick sliced and probably rotisserie. For the side I had sweet potato tater tots. DELISH! The have regular fries, sweet fries, tater tots, onion rings, etc. Great looking salads, Chicago-style dogs, gourmet burgers and yummy sounding mac and cheese. The only thing keeping it from 5 stars is the price. It's great for dinner, but a little steep for a work day lunch.	business	1	F0dO68TECqEJBhBJ4P0qVA	Cold Beers & Cheeseburgers	Scottsdale	20831 N Scottsdale Rd Ste 117 Scottsdale, AZ 85255	33.6765670776	-111.924674988	[]	True	70	AZ
qsThMZ3lXWYLN4t08ScsNA	2	2009-03-13	1	fuY6Bf4EtW3UwrdLQJa9_Q	4	I really really like Frances.  I love most of the clothes in there, but I can never have them because I can't afford it.  The store in general is pretty cool, there are lots of neat things in here from stationery to clothes to jewelry to baby stuff to dog stuff to vintage stuff.  There is a lot of stuff here.  It's all quite pricey though.  The sales they have every now and then are sorta okay, but still break the bank if you buy anything.  Overall they carry good quality products and the staff is super friendly and helpful.  I can't hate on a place too bad just because I can't afford it.	business	2	W_QXYA7A0IhMrvbckz7eVg	Frances	Phoenix	10 W Camelback Rd Phoenix, AZ 85013	33.5096549988	-112.074539185	[]	True	90	AZ
puy0PzIcCgR3KWJI7llBFQ	0	2012-06-30	0	UTWI0z7nV5zNJLWnOz9Z5A	4	Solid food, great device, and casual environment.  They will not leave you hungry.  Overall, it's really good.	business	0	PiDqfET_ZrDKJSLKe03O9A	Logan's Roadhouse	Mesa	945 N. Dobson Rd. Mesa, AZ 85201	33.4338340759	-111.866844177	[]	True	44	AZ
e0vubCKi8KD8zC2C6FdbuQ	0	2012-04-12	0	7uzj6rJ71toRmdsXyo2suA	4	my son really enjoys islands, great food, casual kid freindly atmoshpere we go here quite a lot and seem to keep coming back	business	1	wv5-4IPtpVA8wdqXu-Onpw	Islands Restaurant	Phoenix	21001 N Tatum Blvd Ste 36-1160 Phoenix, AZ 85050	33.6786155701	-111.974609375	[]	True	29	AZ
qB-qsaSnhbHCt18_AN4Quw	0	2011-12-21	0	1FvrC35rTJ6BWFvRog7tuA	5	Everything was nice. The ice cream was delicious, no overwhelming alcohol taste & an interesting variety of flavors. Service was fine, place was clean. I'll go back, but only because I have a killer sweet tooth and they're in the neighborhood.	business	0	66PQJEHC0tCWGMI4V9KT-Q	Lee's Cream Liqueur	Scottsdale	7137 E Stetson Dr Scottsdale, AZ 85251	33.4993171692	-111.92716217	[]	True	95	AZ
aRkYtXfmEKYG-eTDf_qUsw	2	2009-04-04	1	Ckk1Cne1GHwzmJfo7M4r2w	4	(Un)fortunately for me, lux is close to my house.  I walk there nearly every day and am much poorer because of it.  The coffee and pastries are amazing.  They always play really great music too!	business	1	IUWjTmXc3wLVaMHz33inaA	Lux	Phoenix	4402 N Central Ave Phoenix, AZ 85012	33.5005722046	-112.074111938	[]	True	461	AZ
JuBygU4XDjqSeW9okyvbsQ	0	2010-09-25	1	bu9S6tFKuTrMcNxQaQYMQA	4	After watching her win on Cupcake Wars I was determined to find this place (It's very well hidden)and sample the cupcakes.  I have to say I was not impressed; i make better cupcakes on my own.  More creative and not so sweet you'll go into a diabetic coma.  i did have a California BLT as well and it was a good sandwich although the bread was a little too toasted for my liking.  The staff was friendly, the ambiance was very pleasant and it was clean.  But the cupcakes...really not all that.  Sorry....	business	1	1MyXsAhZK35A6EAr4reLCA	The Coffee Shop	Gilbert	3000 E Ray Rd Gilbert, AZ 85296	33.3218650818	-111.726242065	[]	True	165	AZ
jRfdz5voj40P6WS9L54caw	0	2012-01-03	0	V75NCU3EhqTDwPj5In94DQ	4	Good for an easy and leisurely business lunch or outing with the girls.  The market downstairs is great for takeout and a great selection of bakery treats.	business	1	r-t7IiTSD0QZdt8lOUCqeQ	The Herb Box	Scottsdale	7134 E Stetson Dr Ste 200 Scottsdale, AZ 85251	33.4995040894	-111.927894592	[]	True	236	AZ
